{
  "version": 1,
  "name": "Two-bedroom-zone layout with living room, kitchen, hall and bathroom",
  "units": "m",
  "meta": {
    "source": "image",
    "scale_note": "Used the printed 8.90 m horizontal dimension. Its extension marks align with the exterior wall centerlines at image x=112 and x=824, giving 80 pixels per metre. Confidence is high in this dimension-based scale. Printed room areas do not all agree with the traced geometry; they are retained exactly as printed.",
    "notes": "Origin is the top-left outside corner of the exterior walls at image (100,148); wall coordinates follow strip centerlines. Only one bedroom is labeled on the drawing. No furniture or stairs are drawn. Exterior wall thickness is approximately 0.30 m; interior partitions approximately 0.12 m. Door openings are inferred from the gaps and swing symbols. The drawing has no floor elevation or wall-height annotations."
  },
  "levels": [
    {
      "id": "L0",
      "walls": [
        {
          "id": "w1",
          "from": [
            0.15,
            0.15
          ],
          "to": [
            6.05,
            0.15
          ],
          "kind": "exterior",
          "thickness": 0.3
        },
        {
          "id": "w2",
          "from": [
            6.05,
            0.15
          ],
          "to": [
            9.05,
            0.15
          ],
          "kind": "exterior",
          "thickness": 0.3
        },
        {
          "id": "w3",
          "from": [
            9.05,
            0.15
          ],
          "to": [
            9.05,
            3.35
          ],
          "kind": "exterior",
          "thickness": 0.3
        },
        {
          "id": "w4",
          "from": [
            9.05,
            3.35
          ],
          "to": [
            9.05,
            6.5
          ],
          "kind": "exterior",
          "thickness": 0.3
        },
        {
          "id": "w5",
          "from": [
            0.15,
            6.5
          ],
          "to": [
            2.15,
            6.5
          ],
          "kind": "exterior",
          "thickness": 0.3
        },
        {
          "id": "w6",
          "from": [
            2.15,
            6.5
          ],
          "to": [
            4.15,
            6.5
          ],
          "kind": "exterior",
          "thickness": 0.3
        },
        {
          "id": "w7",
          "from": [
            4.15,
            6.5
          ],
          "to": [
            9.05,
            6.5
          ],
          "kind": "exterior",
          "thickness": 0.3
        },
        {
          "id": "w8",
          "from": [
            0.15,
            0.15
          ],
          "to": [
            0.15,
            3.35
          ],
          "kind": "exterior",
          "thickness": 0.3
        },
        {
          "id": "w9",
          "from": [
            0.15,
            3.35
          ],
          "to": [
            0.15,
            6.5
          ],
          "kind": "exterior",
          "thickness": 0.3
        },
        {
          "id": "w10",
          "from": [
            0.15,
            3.35
          ],
          "to": [
            2.15,
            3.35
          ],
          "kind": "interior",
          "thickness": 0.12
        },
        {
          "id": "w11",
          "from": [
            2.15,
            3.35
          ],
          "to": [
            4.15,
            3.35
          ],
          "kind": "interior",
          "thickness": 0.12
        },
        {
          "id": "w12",
          "from": [
            4.15,
            3.35
          ],
          "to": [
            6.05,
            3.35
          ],
          "kind": "interior",
          "thickness": 0.12
        },
        {
          "id": "w13",
          "from": [
            6.05,
            3.35
          ],
          "to": [
            9.05,
            3.35
          ],
          "kind": "interior",
          "thickness": 0.12
        },
        {
          "id": "w14",
          "from": [
            6.05,
            0.15
          ],
          "to": [
            6.05,
            3.35
          ],
          "kind": "interior",
          "thickness": 0.12
        },
        {
          "id": "w15",
          "from": [
            2.15,
            3.35
          ],
          "to": [
            2.15,
            6.5
          ],
          "kind": "interior",
          "thickness": 0.12
        },
        {
          "id": "w16",
          "from": [
            4.15,
            3.35
          ],
          "to": [
            4.15,
            6.5
          ],
          "kind": "interior",
          "thickness": 0.12
        }
      ],
      "openings": [
        {
          "id": "d1",
          "wall": "w5",
          "type": "door",
          "offset": 0.45,
          "width": 0.9
        },
        {
          "id": "d2",
          "wall": "w10",
          "type": "door",
          "offset": 0.65,
          "width": 0.9
        },
        {
          "id": "d3",
          "wall": "w15",
          "type": "door",
          "offset": 1.25,
          "width": 0.8
        },
        {
          "id": "d4",
          "wall": "w12",
          "type": "door",
          "offset": 0.55,
          "width": 0.85
        },
        {
          "id": "d5",
          "wall": "w14",
          "type": "door",
          "offset": 1.15,
          "width": 0.9
        },
        {
          "id": "win1",
          "wall": "w1",
          "type": "window",
          "offset": 0.65,
          "width": 1.7
        },
        {
          "id": "win2",
          "wall": "w1",
          "type": "window",
          "offset": 3.55,
          "width": 1.75
        },
        {
          "id": "win3",
          "wall": "w2",
          "type": "window",
          "offset": 0.8,
          "width": 1.45
        },
        {
          "id": "win4",
          "wall": "w3",
          "type": "window",
          "offset": 1,
          "width": 1.2
        },
        {
          "id": "win5",
          "wall": "w4",
          "type": "window",
          "offset": 1,
          "width": 1.2
        },
        {
          "id": "win6",
          "wall": "w7",
          "type": "window",
          "offset": 0.55,
          "width": 1.3
        },
        {
          "id": "win7",
          "wall": "w7",
          "type": "window",
          "offset": 2.95,
          "width": 1.45
        },
        {
          "id": "win8",
          "wall": "w6",
          "type": "window",
          "offset": 0.7,
          "width": 0.6
        },
        {
          "id": "win9",
          "wall": "w9",
          "type": "window",
          "offset": 1.3,
          "width": 0.6
        },
        {
          "id": "win10",
          "wall": "w8",
          "type": "window",
          "offset": 1,
          "width": 1.25
        }
      ],
      "rooms": [
        {
          "id": "r1",
          "name": "Living room",
          "polygon": [
            [
              0.15,
              0.15
            ],
            [
              6.05,
              0.15
            ],
            [
              6.05,
              3.35
            ],
            [
              4.15,
              3.35
            ],
            [
              2.15,
              3.35
            ],
            [
              0.15,
              3.35
            ]
          ],
          "area": 18.9
        },
        {
          "id": "r2",
          "name": "Bedroom",
          "polygon": [
            [
              6.05,
              0.15
            ],
            [
              9.05,
              0.15
            ],
            [
              9.05,
              3.35
            ],
            [
              6.05,
              3.35
            ]
          ],
          "area": 9.6
        },
        {
          "id": "r3",
          "name": "Hall",
          "polygon": [
            [
              0.15,
              3.35
            ],
            [
              2.15,
              3.35
            ],
            [
              2.15,
              6.5
            ],
            [
              0.15,
              6.5
            ]
          ],
          "area": 6.3
        },
        {
          "id": "r4",
          "name": "Bathroom",
          "polygon": [
            [
              2.15,
              3.35
            ],
            [
              4.15,
              3.35
            ],
            [
              4.15,
              6.5
            ],
            [
              2.15,
              6.5
            ]
          ],
          "area": 6.3
        },
        {
          "id": "r5",
          "name": "Kitchen",
          "polygon": [
            [
              4.15,
              3.35
            ],
            [
              6.05,
              3.35
            ],
            [
              9.05,
              3.35
            ],
            [
              9.05,
              6.5
            ],
            [
              4.15,
              6.5
            ]
          ],
          "area": 15.4
        }
      ],
      "furniture": [],
      "stairs": []
    }
  ]
}
