{
  "version": 1,
  "name": "Small apartment with hall, bathroom, kitchen, living room and bedroom",
  "units": "m",
  "meta": {
    "source": "image",
    "scale_note": "Scale from the printed 9.20 m dimension line. It runs between the centerlines of the left and right exterior walls, about 736 px, which gives 80 px per m. The printed room areas (18.9, 9.1, 6.0, 6.0, 15.6 m2) match the polygons, so I am fairly sure of the scale.",
    "notes": "Origin is the top-left outer corner of the exterior wall. Wall thickness is about 0.3 m. Opening positions are estimated from pixels. The hall window on the left wall is small and uncertain. The living-room rectangle, the skylight-like crossed box in the bedroom, the round object in the hall and the kitchen cabinet outlines are left out because I could not name them clearly. Bed, bathtub, toilet, basin, sink and stove are included with approximate sizes."
  },
  "levels": [
    {
      "id": "L0",
      "walls": [
        {
          "id": "w_top",
          "from": [
            0.15,
            0.15
          ],
          "to": [
            9.35,
            0.15
          ],
          "kind": "exterior",
          "thickness": 0.3
        },
        {
          "id": "w_right",
          "from": [
            9.35,
            0.15
          ],
          "to": [
            9.35,
            6.2
          ],
          "kind": "exterior",
          "thickness": 0.3
        },
        {
          "id": "w_bottom",
          "from": [
            9.35,
            6.2
          ],
          "to": [
            0.15,
            6.2
          ],
          "kind": "exterior",
          "thickness": 0.3
        },
        {
          "id": "w_left",
          "from": [
            0.15,
            6.2
          ],
          "to": [
            0.15,
            0.15
          ],
          "kind": "exterior",
          "thickness": 0.3
        },
        {
          "id": "w_mid",
          "from": [
            0.15,
            3.2
          ],
          "to": [
            9.35,
            3.2
          ],
          "kind": "interior",
          "thickness": 0.2
        },
        {
          "id": "w_bed",
          "from": [
            6.35,
            0.15
          ],
          "to": [
            6.35,
            3.2
          ],
          "kind": "interior",
          "thickness": 0.2
        },
        {
          "id": "w_bath",
          "from": [
            2.15,
            3.2
          ],
          "to": [
            2.15,
            6.2
          ],
          "kind": "interior",
          "thickness": 0.2
        },
        {
          "id": "w_kit",
          "from": [
            4.15,
            3.2
          ],
          "to": [
            4.15,
            6.2
          ],
          "kind": "interior",
          "thickness": 0.2
        }
      ],
      "openings": [
        {
          "id": "win_t1",
          "wall": "w_top",
          "type": "window",
          "offset": 0.9,
          "width": 1.3
        },
        {
          "id": "win_t2",
          "wall": "w_top",
          "type": "window",
          "offset": 3.85,
          "width": 1.65
        },
        {
          "id": "win_t3",
          "wall": "w_top",
          "type": "window",
          "offset": 6.85,
          "width": 1.7
        },
        {
          "id": "win_r1",
          "wall": "w_right",
          "type": "window",
          "offset": 0.7,
          "width": 1.6
        },
        {
          "id": "win_r2",
          "wall": "w_right",
          "type": "window",
          "offset": 3.35,
          "width": 2.05
        },
        {
          "id": "win_b1",
          "wall": "w_bottom",
          "type": "window",
          "offset": 0.55,
          "width": 1.5
        },
        {
          "id": "win_b2",
          "wall": "w_bottom",
          "type": "window",
          "offset": 3.15,
          "width": 1.55
        },
        {
          "id": "win_b3",
          "wall": "w_bottom",
          "type": "window",
          "offset": 5.9,
          "width": 0.6
        },
        {
          "id": "win_l1",
          "wall": "w_left",
          "type": "window",
          "offset": 1.2,
          "width": 0.6
        },
        {
          "id": "win_l2",
          "wall": "w_left",
          "type": "window",
          "offset": 3.8,
          "width": 1.5
        },
        {
          "id": "d_front",
          "wall": "w_bottom",
          "type": "door",
          "offset": 7.85,
          "width": 0.9
        },
        {
          "id": "d_hall",
          "wall": "w_mid",
          "type": "door",
          "offset": 0.65,
          "width": 0.9
        },
        {
          "id": "d_kitchen",
          "wall": "w_mid",
          "type": "door",
          "offset": 4.8,
          "width": 0.85
        },
        {
          "id": "d_bed",
          "wall": "w_bed",
          "type": "door",
          "offset": 1.225,
          "width": 0.92
        },
        {
          "id": "d_bath",
          "wall": "w_bath",
          "type": "door",
          "offset": 0.95,
          "width": 0.8
        }
      ],
      "rooms": [
        {
          "id": "r_living",
          "name": "Living room",
          "polygon": [
            [
              0.15,
              0.15
            ],
            [
              6.35,
              0.15
            ],
            [
              6.35,
              3.2
            ],
            [
              0.15,
              3.2
            ]
          ],
          "area": 18.9
        },
        {
          "id": "r_bed",
          "name": "Bedroom",
          "polygon": [
            [
              6.35,
              0.15
            ],
            [
              9.35,
              0.15
            ],
            [
              9.35,
              3.2
            ],
            [
              6.35,
              3.2
            ]
          ],
          "area": 9.1
        },
        {
          "id": "r_hall",
          "name": "Hall",
          "polygon": [
            [
              0.15,
              3.2
            ],
            [
              2.15,
              3.2
            ],
            [
              2.15,
              6.2
            ],
            [
              0.15,
              6.2
            ]
          ],
          "area": 6
        },
        {
          "id": "r_bath",
          "name": "Bathroom",
          "polygon": [
            [
              2.15,
              3.2
            ],
            [
              4.15,
              3.2
            ],
            [
              4.15,
              6.2
            ],
            [
              2.15,
              6.2
            ]
          ],
          "area": 6
        },
        {
          "id": "r_kitchen",
          "name": "Kitchen",
          "polygon": [
            [
              4.15,
              3.2
            ],
            [
              9.35,
              3.2
            ],
            [
              9.35,
              6.2
            ],
            [
              4.15,
              6.2
            ]
          ],
          "area": 15.6
        }
      ],
      "furniture": [
        {
          "id": "f_bed",
          "type": "bed-double",
          "center": [
            8.15,
            1.675
          ],
          "size": [
            2,
            1.6
          ],
          "rotation": 180
        },
        {
          "id": "f_tub",
          "type": "bathtub",
          "center": [
            3.15,
            5.69
          ],
          "size": [
            1.55,
            0.65
          ]
        },
        {
          "id": "f_toilet",
          "type": "toilet",
          "center": [
            3.7,
            3.65
          ],
          "size": [
            0.4,
            0.7
          ]
        },
        {
          "id": "f_basin",
          "type": "basin",
          "center": [
            2.63,
            3.65
          ],
          "size": [
            0.5,
            0.4
          ]
        },
        {
          "id": "f_sink",
          "type": "sink",
          "center": [
            5.5,
            3.69
          ],
          "size": [
            0.6,
            0.5
          ]
        },
        {
          "id": "f_stove",
          "type": "stove",
          "center": [
            6.89,
            3.69
          ],
          "size": [
            0.6,
            0.6
          ]
        }
      ],
      "stairs": []
    }
  ]
}
