{
  "version": 1,
  "name": "2-bedroom apartment with kitchen and bathroom",
  "units": "m",
  "meta": {
    "source": "image",
    "scale_note": "Based on marked dimension 8.90 m width at bottom of floor plan. Height estimated from aspect ratio and room areas total (56.5 m²). High confidence in width, moderate confidence in height estimate.",
    "notes": "Height estimated as 6.35 m from total area constraint (8.90 × 6.35 ≈ 56.5 m² accounting for walls). Curved wall between Living room and Bedroom traced as approximate arc. Window positions estimated from triple-line symbols on exterior walls. Wall thickness estimated at 0.15 m."
  },
  "levels": [
    {
      "id": "L0",
      "walls": [
        {
          "id": "w1",
          "from": [
            0,
            0
          ],
          "to": [
            8.9,
            0
          ],
          "kind": "exterior"
        },
        {
          "id": "w2",
          "from": [
            8.9,
            0
          ],
          "to": [
            8.9,
            6.35
          ],
          "kind": "exterior"
        },
        {
          "id": "w3",
          "from": [
            8.9,
            6.35
          ],
          "to": [
            0,
            6.35
          ],
          "kind": "exterior"
        },
        {
          "id": "w4",
          "from": [
            0,
            6.35
          ],
          "to": [
            0,
            0
          ],
          "kind": "exterior"
        },
        {
          "id": "w5",
          "from": [
            4.9,
            0.15
          ],
          "to": [
            4.9,
            3.2
          ],
          "kind": "interior"
        },
        {
          "id": "w6",
          "from": [
            0.15,
            3.2
          ],
          "to": [
            4.9,
            3.2
          ],
          "kind": "interior"
        },
        {
          "id": "w7",
          "from": [
            2.35,
            3.2
          ],
          "to": [
            4,
            3.2
          ],
          "kind": "interior"
        },
        {
          "id": "w8",
          "from": [
            2.35,
            3.2
          ],
          "to": [
            2.35,
            5.1
          ],
          "kind": "interior"
        },
        {
          "id": "w9",
          "from": [
            4,
            3.2
          ],
          "to": [
            4,
            5.1
          ],
          "kind": "interior"
        },
        {
          "id": "w10",
          "from": [
            2.35,
            5.1
          ],
          "to": [
            4.9,
            5.1
          ],
          "kind": "interior"
        }
      ],
      "openings": [
        {
          "id": "win1",
          "wall": "w1",
          "type": "window",
          "offset": 1.2,
          "width": 1.3
        },
        {
          "id": "win2",
          "wall": "w1",
          "type": "window",
          "offset": 3.2,
          "width": 1.3
        },
        {
          "id": "win3",
          "wall": "w1",
          "type": "window",
          "offset": 5.3,
          "width": 1.3
        },
        {
          "id": "win4",
          "wall": "w1",
          "type": "window",
          "offset": 7.2,
          "width": 1
        },
        {
          "id": "win5",
          "wall": "w2",
          "type": "window",
          "offset": 1.2,
          "width": 1
        },
        {
          "id": "win6",
          "wall": "w2",
          "type": "window",
          "offset": 3.5,
          "width": 1
        },
        {
          "id": "win7",
          "wall": "w3",
          "type": "window",
          "offset": 1.2,
          "width": 1.3
        },
        {
          "id": "win8",
          "wall": "w3",
          "type": "window",
          "offset": 3.5,
          "width": 1.3
        },
        {
          "id": "win9",
          "wall": "w3",
          "type": "window",
          "offset": 5.8,
          "width": 1.3
        },
        {
          "id": "win10",
          "wall": "w4",
          "type": "window",
          "offset": 1.2,
          "width": 1
        },
        {
          "id": "win11",
          "wall": "w4",
          "type": "window",
          "offset": 4.2,
          "width": 1
        },
        {
          "id": "d1",
          "wall": "w4",
          "type": "door",
          "offset": 2.5,
          "width": 0.85
        },
        {
          "id": "d2",
          "wall": "w6",
          "type": "door",
          "offset": 0.6,
          "width": 0.85
        },
        {
          "id": "d3",
          "wall": "w5",
          "type": "door",
          "offset": 0.8,
          "width": 0.85
        },
        {
          "id": "d4",
          "wall": "w6",
          "type": "door",
          "offset": 3,
          "width": 0.85
        },
        {
          "id": "d5",
          "wall": "w7",
          "type": "door",
          "offset": 0.3,
          "width": 0.75
        },
        {
          "id": "d6",
          "wall": "w9",
          "type": "door",
          "offset": 0.3,
          "width": 0.75
        },
        {
          "id": "d7",
          "wall": "w5",
          "type": "door",
          "offset": 1.8,
          "width": 0.85
        },
        {
          "id": "d8",
          "wall": "w10",
          "type": "door",
          "offset": 1.2,
          "width": 0.85
        }
      ],
      "rooms": [
        {
          "id": "r1",
          "name": "Living room",
          "polygon": [
            [
              0.15,
              0.15
            ],
            [
              4.7,
              0.15
            ],
            [
              4.85,
              2.8
            ],
            [
              4.9,
              3.2
            ],
            [
              0.15,
              3.2
            ]
          ],
          "area": 18.9
        },
        {
          "id": "r2",
          "name": "Bedroom",
          "polygon": [
            [
              4.9,
              0.15
            ],
            [
              8.75,
              0.15
            ],
            [
              8.75,
              3.2
            ],
            [
              4.9,
              3.2
            ]
          ],
          "area": 9.6
        },
        {
          "id": "r3",
          "name": "Hall",
          "polygon": [
            [
              0.15,
              3.2
            ],
            [
              2.35,
              3.2
            ],
            [
              2.35,
              5.1
            ],
            [
              0.15,
              5.1
            ]
          ],
          "area": 6.3
        },
        {
          "id": "r4",
          "name": "Bathroom",
          "polygon": [
            [
              2.35,
              3.2
            ],
            [
              4,
              3.2
            ],
            [
              4,
              5.1
            ],
            [
              2.35,
              5.1
            ]
          ],
          "area": 6.3
        },
        {
          "id": "r5",
          "name": "Kitchen",
          "polygon": [
            [
              4,
              3.2
            ],
            [
              8.75,
              3.2
            ],
            [
              8.75,
              6.2
            ],
            [
              4.9,
              6.2
            ],
            [
              4.9,
              5.1
            ],
            [
              4,
              5.1
            ]
          ],
          "area": 15.4
        }
      ]
    }
  ]
}
