{
  "version": 1,
  "name": "pc9c8",
  "units": "m",
  "meta": {
    "source": "image",
    "scale_note": "sketch with no printed scale or areas: scale from standard door 0.85 m; the six door chords measure 63 to 67 px (mean about 66), so about 77 px per metre (a guess, not a measurement)",
    "notes": "Wavy lines make positions good to about 15 cm and the whole scale about 10 percent uncertain. The thin-walled box above the Living room has no printed name; I called it Balcony. The wide gap in none of the walls was read as a passage."
  },
  "levels": [
    {
      "id": "L0",
      "walls": [
        { "id": "w1", "from": [0, 1.35], "to": [9.2, 1.35], "kind": "exterior" },
        { "id": "w2", "from": [9.2, 1.35], "to": [9.2, 7.85], "kind": "exterior" },
        { "id": "w3", "from": [0, 7.85], "to": [9.2, 7.85], "kind": "exterior" },
        { "id": "w4", "from": [0, 1.35], "to": [0, 7.85], "kind": "exterior" },
        { "id": "w5", "from": [0, 4.55], "to": [9.2, 4.55], "kind": "interior" },
        { "id": "w6", "from": [6.3, 1.35], "to": [6.3, 4.55], "kind": "interior" },
        { "id": "w7", "from": [1.9, 4.55], "to": [1.9, 7.85], "kind": "interior" },
        { "id": "w8", "from": [3.85, 4.55], "to": [3.85, 7.85], "kind": "interior" },
        { "id": "w9", "from": [0.95, 1.35], "to": [0.95, 0], "kind": "exterior", "thickness": 0.08 },
        { "id": "w10", "from": [0.95, 0], "to": [3.95, 0], "kind": "exterior", "thickness": 0.08 },
        { "id": "w11", "from": [3.95, 0], "to": [3.95, 1.35], "kind": "exterior", "thickness": 0.08 }
      ],
      "openings": [
        { "id": "o1", "wall": "w1", "type": "door", "offset": 2.05, "width": 0.85, "hinge": "start", "opens_to": "left" },
        { "id": "o2", "wall": "w1", "type": "window", "offset": 3.95, "width": 1.55 },
        { "id": "o3", "wall": "w1", "type": "window", "offset": 7.1, "width": 1.35 },
        { "id": "o4", "wall": "w2", "type": "window", "offset": 0.8, "width": 1.65 },
        { "id": "o5", "wall": "w2", "type": "window", "offset": 4.25, "width": 1.25 },
        { "id": "o6", "wall": "w3", "type": "door", "offset": 0.45, "width": 0.85, "hinge": "start", "opens_to": "left" },
        { "id": "o7", "wall": "w3", "type": "window", "offset": 2.6, "width": 0.55 },
        { "id": "o8", "wall": "w3", "type": "window", "offset": 4.55, "width": 1.25 },
        { "id": "o9", "wall": "w3", "type": "window", "offset": 7.1, "width": 1.4 },
        { "id": "o10", "wall": "w4", "type": "window", "offset": 0.9, "width": 1.45 },
        { "id": "o11", "wall": "w4", "type": "window", "offset": 4.6, "width": 0.55 },
        { "id": "o12", "wall": "w5", "type": "door", "offset": 0.45, "width": 0.85, "hinge": "start", "opens_to": "left" },
        { "id": "o13", "wall": "w5", "type": "door", "offset": 4.55, "width": 0.85, "hinge": "start", "opens_to": "left" },
        { "id": "o14", "wall": "w6", "type": "door", "offset": 1.05, "width": 0.85, "hinge": "start", "opens_to": "left" },
        { "id": "o15", "wall": "w7", "type": "door", "offset": 1.2, "width": 0.8, "hinge": "start", "opens_to": "left" }
      ],
      "rooms": [
        { "id": "r1", "name": "Living room", "polygon": [[0, 1.35], [6.3, 1.35], [6.3, 4.55], [0, 4.55]] },
        { "id": "r2", "name": "Bedroom", "polygon": [[6.3, 1.35], [9.2, 1.35], [9.2, 4.55], [6.3, 4.55]] },
        { "id": "r3", "name": "Hall", "polygon": [[0, 4.55], [1.9, 4.55], [1.9, 7.85], [0, 7.85]] },
        { "id": "r4", "name": "Bathroom", "polygon": [[1.9, 4.55], [3.85, 4.55], [3.85, 7.85], [1.9, 7.85]] },
        { "id": "r5", "name": "Kitchen", "polygon": [[3.85, 4.55], [9.2, 4.55], [9.2, 7.85], [3.85, 7.85]] },
        { "id": "r6", "name": "Balcony", "polygon": [[0.95, 0], [3.95, 0], [3.95, 1.35], [0.95, 1.35]] }
      ]
    }
  ]
}
